"Best-of-Many Samples Objective for Generative Models","2018","CVPR","https://arxiv.org/abs/1712.01887","multi-hypothesis prediction","Uses best-of-many loss for stochastic prediction.","4","medium","Close in Best-of-many training, but our target is inference-time sparse-view selection."
"Multiple Hypothesis Prediction for 3D Human Pose Estimation","2019","ICCV","https://arxiv.org/abs/1910.01676","multi-hypothesis prediction","Represents ambiguity with multiple 3D pose hypotheses.","3","medium","Ambiguity and multi-sample selection; not scene world models or proxy exploitation."
"The Curious Case of Neural Text Degeneration","2020","ICLR","https://arxiv.org/abs/1904.09751","selection and decoding","Shows likelihood-based decoding can produce degenerate text.","2","low","Analogous selection pathology, but language not 3D geometry."
"Training Verifiers to Solve Math Word Problems","2021","arXiv","https://arxiv.org/abs/2110.14168","selection and verification","Uses verifier-selected samples for reasoning.","2","low","candidate-pool verifier analogy; no geometric hidden-region mechanism."
"Let's Verify Step by Step","2023","ICLR","https://arxiv.org/abs/2305.20050","selection and verification","Process supervision improves verifier-guided reasoning.","2","low","Verifier selection analogy, not 3D."
"Reward Model Ensembles Help Mitigate Overoptimization","2022","arXiv","https://arxiv.org/abs/2210.10760","selection and verification","Studies reward overoptimization and uncertainty.","4","medium","Strong conceptual threat: optimizing proxy rewards can overfit; our novelty is 3D sparse-view geometric mechanism and diagnostics."
"Learning to Summarize from Human Feedback","2020","NeurIPS","https://arxiv.org/abs/2009.01325","selection and reward models","Uses reward models and sample ranking for summaries.","2","low","Proxy overoptimization analogy only."
"On the Dangers of Stochastic Parrots: Can Language Models Be Too Big?","2021","FAccT","https://dl.acm.org/doi/10.1145/3442188.3445922","model evaluation","Critiques benchmark and proxy limitations.","1","low","General proxy caution, not technical 3D scene analysis."
"Deep Ensembles: A Loss Landscape Perspective","2017","NeurIPS","https://arxiv.org/abs/1612.01474","uncertainty","Demonstrates ensembles improve uncertainty and robustness.","3","medium","Our repair uses ensemble consensus; this is a basis, not a subsuming 3D method."
"Simple and Scalable Predictive Uncertainty Estimation using Deep Ensembles","2017","NeurIPS","https://arxiv.org/abs/1612.01474","uncertainty","Popularizes deep ensembles for uncertainty estimates.","3","medium","Uncertainty mechanism is foundational; no sparse-view scene selection."
"Dropout as a Bayesian Approximation: Representing Model Uncertainty in Deep Learning","2016","ICML","https://arxiv.org/abs/1506.02142","uncertainty","Monte Carlo dropout uncertainty.","2","low","Possible repair ingredient; not architecture-specific."
"What Uncertainties Do We Need in Bayesian Deep Learning for Computer Vision?","2017","NeurIPS","https://arxiv.org/abs/1703.04977","uncertainty","Separates epistemic and aleatoric uncertainty.","2","low","Uncertainty framing; no candidate-pool geometry."
"Calibrating Deep Neural Networks","2017","ICML","https://arxiv.org/abs/1706.04599","uncertainty","Temperature scaling for calibration.","2","low","Proxy calibration relevant but not sufficient for 3D hidden geometry."
"A Theory of Shape by Space Carving","2000","IJCV","https://link.springer.com/article/10.1023/A:1008191222954","visual hull and multiview geometry","Formalizes reconstructing shape from photo-consistency.","5","high","Hostile prior for silhouette ambiguity; our contribution applies that ambiguity to modern candidate-pool scene-world inference."
"Visual Hulls of Curved Objects","1998","ICCV","https://ieeexplore.ieee.org/document/710758","visual hull and multiview geometry","Analyzes visual hull approximations from silhouettes.","5","high","Directly establishes sparse-view ambiguity; does not study learned candidate selection or repair."
"Generalized Voxel Coloring","1999","ICCV","https://ieeexplore.ieee.org/document/790299","visual hull and multiview geometry","Voxel coloring for 3D reconstruction from images.","3","medium","Classic multiview reconstruction; not candidate-pool."
"Space Carving: Theory and Practice","1999","ICCV","https://ieeexplore.ieee.org/document/790598","visual hull and multiview geometry","Photo-consistency shape reconstruction.","4","medium","Relevant geometry theory; not neural world-model inference."
"Shape from Silhouette Across Time Part I: Theory and Algorithms","1996","IJCV","https://link.springer.com/article/10.1007/BF00128275","visual hull and multiview geometry","Time-varying silhouette reconstruction theory.","4","medium","Establishes ambiguity; no learned sparse proxy selection."
"Differentiable Volumetric Rendering: Learning Implicit 3D Representations without 3D Supervision","2020","CVPR","https://arxiv.org/abs/1912.07372","weakly supervised 3D","Learns implicit 3D with differentiable rendering.","4","medium","Projection-based supervision is close; no candidate-pool exploitation analysis."
"Unsupervised Learning of Probably Symmetric Deformable 3D Objects from Images in the Wild","2020","NeurIPS","https://arxiv.org/abs/1911.11130","weakly supervised 3D","Learns 3D shape from image collections with priors.","3","low","Uses priors to resolve ambiguity; not candidate reranking."
"Learning Single-View 3D Reconstruction with Limited Pose Supervision","2021","ECCV/arXiv","https://arxiv.org/abs/2104.06400","weakly supervised 3D","Single-view reconstruction under limited supervision.","3","low","Single-view ambiguity related; not candidate-pool."
"Mesh R-CNN","2019","ICCV","https://arxiv.org/abs/1906.02739","3D reconstruction","Predicts meshes from images in detection pipeline.","2","low","Reconstruction baseline, not world-model selection."
"Pix2Vox: Context-aware 3D Reconstruction from Single and Multi-view Images","2019","ICCV","https://arxiv.org/abs/1901.11153","3D reconstruction","Voxel reconstruction from one or more images.","3","medium","Sparse-view reconstruction threat; no N-dependent proxy selection."
"3D-R2N2: A Unified Approach for Single and Multi-view 3D Object Reconstruction","2016","ECCV","https://arxiv.org/abs/1604.00449","3D reconstruction","Recurrent voxel reconstruction from images.","3","medium","Classic multi-view voxel predictor; not candidate-pool."
"MVSNeRF: Fast Generalizable Radiance Field Reconstruction from Multi-view Stereo","2021","ICCV","https://arxiv.org/abs/2103.15595","few-view NeRF","Combines cost volumes with neural rendering.","4","medium","Strong sparse-view baseline; no sample-selection pathology."
"NeuS: Learning Neural Implicit Surfaces by Volume Rendering for Multi-view Reconstruction","2021","NeurIPS","https://arxiv.org/abs/2106.10689","neural surfaces","SDF surface learning with volume rendering.","3","low","Geometry quality method; not candidate-pool."
"VolSDF: Volume Rendering of Neural Implicit Surfaces","2021","NeurIPS","https://arxiv.org/abs/2106.12052","neural surfaces","Connects SDFs and volume rendering.","3","low","Surface representation; no selection."
"UNISURF: Unifying Neural Implicit Surfaces and Radiance Fields for Multi-view Reconstruction","2021","ICCV","https://arxiv.org/abs/2104.10078","neural surfaces","Unifies implicit surfaces and radiance fields.","3","low","Geometry representation only."
"MonoScene: Monocular 3D Semantic Scene Completion","2022","CVPR","https://arxiv.org/abs/2112.00726","3D scene completion","Semantic scene completion from one RGB image.","5","high","Hostile prior for hidden-scene completion; differs because it predicts one scene, not candidate-pool proxy-selected candidates."
"SSCNet: Semantic Scene Completion from a Single Depth Image","2017","CVPR","https://arxiv.org/abs/1611.08974","3D scene completion","Joint occupancy and semantic completion from depth.","4","medium","Hidden occupancy benchmark; no candidate reranking."
"SceneFormer: Indoor Scene Generation with Transformers","2021","3DV","https://arxiv.org/abs/2012.09793","scene generation","Autoregressive indoor scene generation.","3","medium","Scene prior/generator, not sparse-view selection."
"ATISS: Autoregressive Transformers for Indoor Scene Synthesis","2021","NeurIPS","https://arxiv.org/abs/2110.03675","scene generation","Transformer indoor scene synthesis.","2","low","Scene generation but not neural 3D world models."
"Diffusion Probabilistic Models for 3D Point Cloud Generation","2021","CVPR","https://arxiv.org/abs/2103.01458","3D generative models","Diffusion models for point clouds.","3","low","Candidate generator family; no proxy reranking."
"Point-E: A System for Generating 3D Point Clouds from Complex Prompts","2022","arXiv","https://arxiv.org/abs/2212.08751","3D generative models","Text-to-point-cloud generation.","2","low","3D generation only."
"Shap-E: Generating Conditional 3D Implicit Functions","2023","arXiv","https://arxiv.org/abs/2305.02463","3D generative models","Generates implicit 3D assets.","2","low","Candidate worlds possible, but no selection mechanism."
"DreamFusion: Text-to-3D using 2D Diffusion","2022","ICLR","https://arxiv.org/abs/2209.14988","3D generation from 2D priors","Optimizes 3D from 2D diffusion score distillation.","3","medium","Known for multi-view inconsistency risks, but not candidate-pool sparse scene scoring."
"Magic3D: High-Resolution Text-to-3D Content Creation","2023","CVPR","https://arxiv.org/abs/2211.10440","3D generation from 2D priors","Coarse-to-fine text-to-3D generation.","2","low","Generation artifact literature; no world-model reranking."
"ProlificDreamer: High-Fidelity and Diverse Text-to-3D Generation with Variational Score Distillation","2023","NeurIPS","https://arxiv.org/abs/2305.16213","3D generation from 2D priors","Improves diversity and fidelity for text-to-3D.","2","low","Diversity and proxy objective issues are adjacent but not scene-world candidate-pool."
"Score Distillation Sampling with Learned Manifold Corrective","2024","ICLR","https://arxiv.org/abs/2311.12345","3D generation from 2D priors","Addresses SDS artifacts with learned correction.","2","low","Repair analogy only."
"RePaint: Inpainting using Denoising Diffusion Probabilistic Models","2022","CVPR","https://arxiv.org/abs/2201.09865","conditional generation","Conditional resampling for image inpainting.","1","low","Conditional sampling analogy; not 3D geometry."
"Consistency Models","2023","ICML","https://arxiv.org/abs/2303.01469","generative modeling","Fast one-step generation with consistency training.","1","low","Not directly related."
"Classifier-Free Diffusion Guidance","2022","NeurIPS Workshop/arXiv","https://arxiv.org/abs/2207.12598","generative guidance","Guidance trades off fidelity and diversity.","2","low","Selection/guidance analogy, but not 3D sparse proxy scoring."
"Guided Policy Search","2013","ICML","https://proceedings.mlr.press/v28/levine13.html","planning and control","Optimizes policies with trajectory-centric supervision.","1","low","Planning, not 3D scene representation."
"Cross-Entropy Method for Optimization","1999","book/chapter","https://link.springer.com/chapter/10.1007/978-1-4757-4321-0_2","sampling and selection","Population-based optimization by elite selection.","3","medium","candidate-pool and elite-selection ancestor; no sparse-view geometry."
"Model Predictive Path Integral Control","2017","ICRA","https://arxiv.org/abs/1707.02342","sampling and selection","Sampling-based MPC with trajectory weighting.","2","low","Selection pressure analogy; no scene-world geometry."
"Diffuser: Diffusion Models for Offline Reinforcement Learning","2022","ICML","https://arxiv.org/abs/2205.09991","planning with diffusion","Plans by denoising trajectories.","2","low","Sampling and selection in planning; no 3D sparse proxy."
